{
  "schema_version": 1,
  "case_id": "synthetic_dev",
  "source_model": "assets/source_model",
  "target_seed": 3109,
  "target_generator": "band_limited_v2",
  "animations": ["00_Walk", "01_Dance2", "05_MagicAttack", "08_SwordAttack", "09_Interactive"],
  "observation_budget": 6,
  "hidden_pose_count": 10,
  "candidate_time_step": 0.2,
  "coverage": {
    "edge_erode_texels": 0,
    "min_union_gain_over_best_single": 0.2,
    "max_best_single_fraction": 0.8
  },
  "viewport": {"x": -1300.0, "y": -650.0, "width": 2450.0, "height": 1900.0},
  "render_size": {"width": 2450, "height": 1900}
}
